{
  "schema_version": "issuer-eligibility-assessment.v0.1",
  "as_of": "2032-04-18T12:00:00Z",
  "standard": {
    "id": "standard.eligibility",
    "version": "0.1"
  },
  "issuer": {
    "name": "Selene Autonomous Resources, PBC",
    "canonical_identifier": "example:selene-autonomous-resources",
    "jurisdiction": "Delaware, United States",
    "entity_type": "public benefit corporation"
  },
  "assessment_basis": "PROJECT_REVIEW_UNVERIFIED",
  "claimed_classification": "NON_TERRESTRIAL_ISSUER",
  "assessed_classification": "NON_TERRESTRIAL_ISSUER",
  "decision_reasoning": "The hypothetical issuer directly controls cislunar and lunar-surface productive assets, has enforceable command and economic rights, and exceeds the project materiality and concentration presumptions on multiple independently stated metrics. This example remains unverified project-proposal output.",
  "gates": {
    "qualifying_nexus": {
      "passed": true,
      "nexus_types": [
        "CONTROLLED_NON_TERRESTRIAL_ASSET",
        "DIRECT_NON_TERRESTRIAL_OPERATIONS",
        "MISSION_CRITICAL_AUTONOMOUS_OPERATION",
        "INFRASTRUCTURE_ENTITLEMENT"
      ],
      "summary": "The intended issuer controls a cislunar relay, a lunar prospecting unit, and a cislunar logistics vehicle used directly in revenue-producing operations.",
      "evidence_references": [
        "evidence://selene/assets/registry-v4",
        "evidence://selene/mission-operations/2032-q1"
      ]
    },
    "material_dependence": {
      "passed": true,
      "measurement_period": "2031-04-01 through 2032-03-31",
      "metrics": [
        {
          "metric": "NT_BACKLOG_SHARE",
          "percentage": 68,
          "basis": "CONTRACTED",
          "numerator_description": "Enforceable contracted backlog requiring cislunar or lunar-surface performance.",
          "denominator_description": "Total enforceable consolidated contracted backlog.",
          "methodology": "Contracts are attributed only when performance requires qualifying beyond-Earth operations; terrestrial support-only contracts are excluded from the numerator.",
          "uncertainty": "Customer termination rights may reduce realized revenue but do not change signed backlog classification at the assessment date.",
          "evidence_references": [
            "evidence://selene/contracts/backlog-2032q1"
          ]
        },
        {
          "metric": "NT_PRODUCTIVE_ASSET_SHARE",
          "percentage": 61,
          "basis": "ASSESSED",
          "numerator_description": "Replacement-cost estimate for qualifying cislunar and lunar-surface productive assets and directly attributable control systems.",
          "denominator_description": "Replacement-cost estimate for all consolidated productive assets.",
          "methodology": "Shared terrestrial support systems are allocated based on documented operational use rather than grossed entirely into the numerator.",
          "uncertainty": "Replacement-cost estimates depend on launch pricing and asset-specific remaining useful life.",
          "evidence_references": [
            "evidence://selene/valuation/replacement-cost-v2"
          ]
        },
        {
          "metric": "NT_CAPEX_SHARE",
          "percentage": 74,
          "basis": "COMMITTED",
          "numerator_description": "Board-approved committed capital expenditure for qualifying fleet expansion, lunar equipment, and cislunar relay capacity.",
          "denominator_description": "Total board-approved committed capital expenditure over the next 24 months.",
          "methodology": "Only funded or contractually committed project capital is counted.",
          "uncertainty": "Schedule changes may move spending between periods.",
          "evidence_references": [
            "evidence://selene/budget/capex-24m-v3"
          ]
        }
      ],
      "materiality_presumption_25_triggered": true,
      "concentration_presumption_50_triggered": true,
      "core_enterprise_override": false,
      "summary": "Multiple qualifying metrics exceed both the 25% materiality presumption and the 50% concentration presumption."
    },
    "rights_control": {
      "passed": true,
      "right_types": [
        "TITLE_OR_BENEFICIAL_OWNERSHIP",
        "COMMAND_CONTROL_AUTHORITY",
        "REVENUE_OR_DATA_RIGHT",
        "SERVICE_CAPACITY_ENTITLEMENT"
      ],
      "summary": "The intended issuer is represented as holding economic title or enforceable capacity rights to the material assets, command authority within documented control boundaries, and the customer revenue/data rights generated by those operations.",
      "evidence_references": [
        "evidence://selene/legal/asset-rights-map-v2",
        "evidence://selene/control/command-authority-v5"
      ]
    },
    "evidence_sufficiency": {
      "passed": true,
      "freshness": "CURRENT",
      "summary": "The hypothetical assessment references recent asset, contract, budget, and control evidence sufficient for a project-level classification, but no factual claims have been independently verified by open-ipo.",
      "evidence_references": [
        "evidence://selene/assets/registry-v4",
        "evidence://selene/contracts/backlog-2032q1",
        "evidence://selene/control/command-authority-v5"
      ]
    }
  },
  "anti_gaming_checks": [
    {
      "check": "CUSTOMER_SECTOR_SUBSTITUTION",
      "status": "PASS",
      "summary": "Backlog is counted based on required beyond-Earth performance, not merely because the customer participates in the space sector.",
      "evidence_references": [
        "evidence://selene/contracts/backlog-2032q1"
      ]
    },
    {
      "check": "SHARED_ASSET_GROSS_UP",
      "status": "PASS",
      "summary": "Shared terrestrial support infrastructure is allocated to the numerator only to the extent economically attributable to qualifying operations.",
      "evidence_references": [
        "evidence://selene/valuation/replacement-cost-v2"
      ]
    },
    {
      "check": "DOUBLE_COUNTING",
      "status": "PASS",
      "summary": "Backlog, asset, and capex percentages are presented as separate indicators and are not summed into a combined eligibility score.",
      "evidence_references": []
    },
    {
      "check": "AUTONOMY_SHORTCUT",
      "status": "PASS",
      "summary": "The classification is supported by economic activity, rights, and operational dependence rather than the mere fact that autonomous agents control parts of the fleet.",
      "evidence_references": [
        "evidence://selene/control/command-authority-v5"
      ]
    }
  ],
  "uncertainties": [
    "Productive-asset replacement cost is sensitive to future launch pricing and remaining useful-life assumptions.",
    "Backlog may not equal realized revenue because customer termination and mission-performance conditions remain applicable."
  ],
  "blocking_questions": [],
  "verification": {
    "status": "PROJECT_UNVERIFIED",
    "summary": "This is a fictional worked example. The structure demonstrates the proposed assessment contract; open-ipo has not independently verified any issuer fact.",
    "verified_evidence_references": []
  },
  "disclaimer": "Illustrative project-proposal assessment only. It is not an adopted Orbital Exchange eligibility determination, securities approval, legal classification, regulatory approval, or investment recommendation."
}
